{
  "authority": {
    "ai_caused_chloe_moffat_death_claims_allowed": false,
    "canonical_product_effects_allowed": false,
    "control_adoption_allowed": false,
    "employer_liability_findings_allowed": false,
    "employer_specific_causation_findings_allowed": false,
    "final_coroner_conclusion_claims_allowed": false,
    "graph_effects_allowed": false,
    "individual_culpability_findings_allowed": false,
    "legal_conclusions_allowed": false,
    "named_case_ai_use_inference_allowed": false,
    "named_case_protected_activity_classification_allowed": false,
    "named_company_intent_beyond_public_record_allowed": false,
    "parent_wave_mutation_allowed": false,
    "private_source_publication_allowed": false,
    "publication_effects_allowed": false,
    "universal_counterpower_effectiveness_findings_allowed": false,
    "universal_prevalence_findings_allowed": false,
    "victim_character_inferences_allowed": false
  },
  "findings": [
    {
      "claim": "The public record makes the attendance-linked data-collection and manager-note workflow addressable without establishing a machine-learning model or automated discipline.",
      "id": "hrdce-01-f01",
      "limits": [
        "The finding is bounded to the cited public record and does not create legal, liability, intent, or universal-effectiveness authority."
      ],
      "source_ids": [
        "amazon-italy-inspection-announcement-2026",
        "amazon-italy-garante-release-2026",
        "amazon-italy-garante-decision-2026",
        "eu-gdpr-2016"
      ],
      "status": "independently_supported_scoped"
    },
    {
      "claim": "An immediate regulatory prohibition is an observable counterpower effect at the processing layer.",
      "id": "hrdce-01-f02",
      "limits": [
        "The finding is bounded to the cited public record and does not create legal, liability, intent, or universal-effectiveness authority."
      ],
      "source_ids": [
        "amazon-italy-inspection-announcement-2026",
        "amazon-italy-garante-release-2026",
        "amazon-italy-garante-decision-2026",
        "eu-gdpr-2016"
      ],
      "status": "effect_recovered_scoped"
    },
    {
      "claim": "Stopping unlawful processing does not by itself establish deletion from every downstream record, restoration for any worker, or compensation for individual loss.",
      "id": "hrdce-01-f03",
      "limits": [
        "The finding is bounded to the cited public record and does not create legal, liability, intent, or universal-effectiveness authority."
      ],
      "source_ids": [
        "amazon-italy-inspection-announcement-2026",
        "amazon-italy-garante-release-2026",
        "amazon-italy-garante-decision-2026",
        "eu-gdpr-2016"
      ],
      "status": "bounded_synthesis"
    },
    {
      "claim": "Because the investigation remained open, implementation, downstream cleanup, and durable organisational learning remain unverified in this packet.",
      "id": "hrdce-01-f04",
      "limits": [
        "The finding is bounded to the cited public record and does not create legal, liability, intent, or universal-effectiveness authority."
      ],
      "source_ids": [
        "amazon-italy-inspection-announcement-2026",
        "amazon-italy-garante-release-2026",
        "amazon-italy-garante-decision-2026",
        "eu-gdpr-2016"
      ],
      "status": "independently_supported_scoped"
    }
  ],
  "jurisdiction": "Italy / European Union",
  "lane_id": "HRDCE-01",
  "named_objects": [
    "Amazon Italia Logistica",
    "Garante per la protezione dei dati personali",
    "Ispettorato Nazionale del Lavoro"
  ],
  "observations": [
    {
      "event": "inspection_opened",
      "id": "hrdce-01-o01",
      "source_ids": [
        "amazon-italy-inspection-announcement-2026",
        "amazon-italy-garante-release-2026",
        "amazon-italy-garante-decision-2026",
        "eu-gdpr-2016"
      ],
      "statement": "Italian data-protection and labour authorities opened joint inspections of Amazon logistics centres concerning surveillance systems and worker rights."
    },
    {
      "event": "attendance_linked_platform",
      "id": "hrdce-01-o02",
      "source_ids": [
        "amazon-italy-inspection-announcement-2026",
        "amazon-italy-garante-release-2026",
        "amazon-italy-garante-decision-2026",
        "eu-gdpr-2016"
      ],
      "statement": "The public decision describes an internal platform linked to attendance that prompted or supported return-from-absence interviews."
    },
    {
      "event": "sensitive_free_text",
      "id": "hrdce-01-o03",
      "source_ids": [
        "amazon-italy-inspection-announcement-2026",
        "amazon-italy-garante-release-2026",
        "amazon-italy-garante-decision-2026",
        "eu-gdpr-2016"
      ],
      "statement": "Managers entered free-text notes that included health conditions, strike and union activity, family matters, and alleged leave misuse."
    },
    {
      "event": "long_retention_and_access",
      "id": "hrdce-01-o04",
      "source_ids": [
        "amazon-italy-inspection-announcement-2026",
        "amazon-italy-garante-release-2026",
        "amazon-italy-garante-decision-2026",
        "eu-gdpr-2016"
      ],
      "statement": "The authority reported that the information accumulated over time, was accessible to multiple managers, and could be retained for years after employment."
    },
    {
      "event": "camera_processing",
      "id": "hrdce-01-o05",
      "source_ids": [
        "amazon-italy-inspection-announcement-2026",
        "amazon-italy-garante-release-2026",
        "amazon-italy-garante-decision-2026",
        "eu-gdpr-2016"
      ],
      "statement": "Four cameras near worker-only bathroom and break-area access points were included in the immediate limitation."
    },
    {
      "event": "immediate_limitation",
      "id": "hrdce-01-o06",
      "source_ids": [
        "amazon-italy-inspection-announcement-2026",
        "amazon-italy-garante-release-2026",
        "amazon-italy-garante-decision-2026",
        "eu-gdpr-2016"
      ],
      "statement": "The authority ordered immediate definitive limitations on specified processing while the broader investigation remained open."
    }
  ],
  "schema_version": 1,
  "source_ids": [
    "amazon-italy-inspection-announcement-2026",
    "amazon-italy-garante-release-2026",
    "amazon-italy-garante-decision-2026",
    "eu-gdpr-2016"
  ],
  "terminal_receipt": {
    "closed_questions": [],
    "open_questions": [
      "whether_the_platform_operated_at_other_italian_sites",
      "whether_any_automated_score_or_model_generated_adverse_action",
      "which_workers_received_record_correction_or_deletion",
      "whether_pay_duties_reputation_or_opportunity_were_restored",
      "whether_any_worker_received_compensation",
      "whether_the_order_changed_retention_access_and_interview_workflows",
      "whether_compliance_was_independently_verified",
      "whether_exits_silence_or_union_activity_entered_later_review"
    ],
    "state": "immediate_processing_prohibition_recovered_ai_use_individual_restoration_and_durable_verification_open"
  },
  "title": "Amazon Italia Logistica sensitive worker profiling and immediate processing prohibition",
  "wave_id": "CN-HRDCE-W06"
}
